{
  "$schema": "https://json-schema.org/draft/2020-12/schema",
  "$id": "https://themark.net/grapheneos-mdm/protocol/desired-state.schema.json",
  "title": "DesiredState",
  "type": "object",
  "additionalProperties": false,
  "required": ["schemaVersion", "requiredPackages", "policyFlags"],
  "properties": {
    "schemaVersion": { "type": "integer", "const": 1 },
    "requiredPackages": {
      "type": "array",
      "items": {
        "type": "object",
        "additionalProperties": false,
        "required": ["packageName"],
        "properties": {
          "packageName": { "type": "string", "minLength": 1 },
          "versionName": { "type": "string" },
          "minVersionCode": { "type": "integer" },
          "apkUrl": { "type": "string", "format": "uri" },
          "sha256": {
            "type": "string",
            "pattern": "^[A-Fa-f0-9]{64}$",
            "description": "Hex SHA-256 of the APK bytes; required before install when apkUrl is set."
          },
          "signingCertSha256": {
            "type": "string",
            "pattern": "^[A-Fa-f0-9]{64}$",
            "description": "Hex SHA-256 of the APK signing certificate (DER)."
          }
        }
      }
    },
    "policyFlags": {
      "type": "object",
      "additionalProperties": false,
      "properties": {
        "disallowAddUser": { "type": "boolean" },
        "disallowFactoryReset": { "type": "boolean" },
        "disallowInstallUnknownSources": { "type": "boolean" },
        "cameraDisabled": { "type": "boolean" },
        "minSecurityPatch": {
          "type": "string",
          "pattern": "^[0-9]{4}-[0-9]{2}-[0-9]{2}$",
          "description": "Device SECURITY_PATCH must be this date or newer. The agent does not wipe; the next inventory reports securityPatchOk."
        },
        "passwordComplexity": {
          "type": "string",
          "enum": ["none", "low", "medium", "high"],
          "description": "Required password complexity. none clears it. Omit to leave the device alone."
        },
        "maximumTimeToLockMs": {
          "type": "integer",
          "minimum": 0,
          "description": "Lock timeout in milliseconds. 0 clears the limit. Omit to leave the device alone."
        },
        "suspendedPackages": {
          "type": "array",
          "items": { "type": "string", "minLength": 1 },
          "description": "Full set of packages this agent should suspend. Omit to leave suspension alone. The agent package is ignored."
        },
        "hiddenPackages": {
          "type": "array",
          "items": { "type": "string", "minLength": 1 },
          "description": "Full set of packages this agent should hide. Omit to leave hidden apps alone. The agent package is ignored."
        },
        "lockTaskPackages": {
          "type": "array",
          "items": { "type": "string" }
        }
      }
    },
    "commands": {
      "type": "array",
      "items": {
        "type": "object",
        "additionalProperties": false,
        "required": ["type"],
        "properties": {
          "type": {
            "type": "string",
            "enum": ["noop", "lock", "wipe", "reboot", "checkin_now"]
          },
          "id": { "type": "string" }
        }
      }
    }
  }
}
